{
  "$schema": "https://json-schema.org/draft/2020-12/schema",
  "$id": "https://antigravity.local/contract/evidence.schema.json",
  "title": "Antigravity evidence bundle (evidence.json)",
  "type": "object",
  "required": ["evidence_version", "run_id", "created_at", "engine_version", "baseline_version",
               "baseline_sha256", "scan", "report", "scan_sha256", "report_sha256", "evidence_id"],
  "properties": {
    "evidence_version": { "type": "string", "pattern": "^1\\.\\d+\\.\\d+$" },
    "run_id":           { "type": "string" },
    "created_at":       { "type": "string", "pattern": "^\\d{4}-\\d{2}-\\d{2}T\\d{2}:\\d{2}:\\d{2}Z$" },
    "engine_version":   { "type": "string" },
    "baseline_version": { "type": "string" },
    "baseline_sha256":  { "type": "string", "pattern": "^sha256:[0-9a-f]{64}$" },
    "scan":             { "type": "object" },
    "report":           { "type": "object" },
    "scan_sha256":      { "type": "string", "pattern": "^sha256:[0-9a-f]{64}$" },
    "report_sha256":    { "type": "string", "pattern": "^sha256:[0-9a-f]{64}$" },
    "evidence_id":      { "type": "string", "pattern": "^AG-[0-9a-f]{12}$" }
  }
}
