{
  "evidence_version": "1.0.0",
  "run_id": "2026-10-28T12-00-00Z_abcd",
  "created_at": "2026-10-28T12:00:01Z",
  "engine_version": "0.1.0",
  "baseline_version": "2026-10-01",
  "baseline_sha256": "sha256:0000000000000000000000000000000000000000000000000000000000000000",
  "scan": {},
  "report": {},
  "scan_sha256": "sha256:1111111111111111111111111111111111111111111111111111111111111111",
  "report_sha256": "sha256:2222222222222222222222222222222222222222222222222222222222222222",
  "evidence_id": "AG-222222222222"
}
